museo_id,museo_nombre,museo_tematica_n1,museo_fecha_fundacion,museo_adscripcion,estado_id,nom_ent,municipio_id,nom_mun,localidad_id,nom_loc,museo_calle_numero,museo_colonia,museo_cp,museo_telefono1,pagina_web,pagina_web2,email,twitter,gmaps_longitud,gmaps_latitud,link_sic,fecha_mod
1992,"Museo La Ciudad y la Torre a través de los siglos","","2006-03-17","Miralto, S.A. de C.V.",9,"Ciudad de México",15,"Cuauhtémoc",1,"Cuauhtémoc","Eje Central Lázaro Cárdenas 2, piso 38","Centro","06007","55 5518 7423","http://torrelatinoamericana.com.mx/museo-ciudad-de-mexico/  ","","rhernandez@torrelatino.com","",-99.1407,19.43397,"http://sic.gob.mx/ficha.php?table=museo&table_id=1992","2020-04-22 05:29:18-05"
2075,"Museo Centro de la Imagen","","1994-05-04","Secretaría de Cultura",9,"Ciudad de México",15,"Cuauhtémoc",1,"Cuauhtémoc","Plaza de la Ciudadela 2 ","Centro Histórico","06040","55 4155 0850","https://centrodelaimagen.cultura.gob.mx","https://pics-ci.com.mx/","direccion_ci@cultura.gob.mx; comunicacion_ci@cultura.gob.mx","cimagen",-99.14886,19.42902,"http://sic.gob.mx/ficha.php?table=museo&table_id=2075","2021-05-04 07:39:54-05"
685,"Museo Universitario de Ciencias y Artes (MUCA) Roma","Arte","1999-04-01","UNAM/Dirección General de Artes Visuales",9,"Ciudad de México",15,"Cuauhtémoc",1,"Cuauhtémoc","Tonalá 51","Col. Roma Norte","06700","(55) 5511 0925","http://www.mucaroma.unam.mx","","lmucaroma@gmail.com","MUCAROMA",-99.16305,19.41894,"http://sic.gob.mx/ficha.php?table=museo&table_id=685","2021-09-06 07:36:40-05"
1867,"Museo del Padre Pro","Historia","1995-01-01","Parroquia de la Sagrada Familia",9,"Ciudad de México",15,"Cuauhtémoc",1,"Cuauhtémoc","Puebla 144 entre Jalapa y Orizaba","Col. Roma","06700","55 5511 9035","http://romacondesa.nguideqr.mx/ArteGallRC/AGPadrePro.html","","padre.pro@hotmail.com","",-99.16116,19.42246,"http://sic.gob.mx/ficha.php?table=museo&table_id=1867","2021-07-27 08:51:27-05"
969,"Museo del Calzado El Borceguí","Especializado","1991-03-01","Museo y Centro Cultural de El Borcegui, A.C.",9,"Ciudad de México",15,"Cuauhtémoc",1,"Cuauhtémoc","Bolívar 27,  piso 1","Centro Histórico","06000","55 5521 8380 ext. 110","","","museodelcalzadoborcegui@hotmail.com","MuseodelCalzado",-99.13856,19.43282,"http://sic.gob.mx/ficha.php?table=museo&table_id=969","2021-03-05 05:02:45-06"
711,"Sala de la Odontología Mexicana Dr. Samuel Fastlicht","Ciencia y tecnología","2004-10-23","UNAM/Facultad de Odontología",9,"Ciudad de México",15,"Cuauhtémoc",1,"Cuauhtémoc","Primo Verdad 2","Centro Histórico","06020","55 5522 7128","","","dephistfo@yahoo.com.mx","",-99.13074,19.43435,"http://sic.gob.mx/ficha.php?table=museo&table_id=711","2020-04-23 15:46:55-05"
1893,"Museo UNAM Hoy","Historia","2015-11-05","UNAM/Instituto de Investigaciones sobre la Universidad y la Educación (IISUE)",9,"Ciudad de México",15,"Cuauhtémoc",1,"Cuauhtémoc","Moneda 2","Centro Histórico","06010","55 5665 1661","http://www.iisue.unam.mx/museo/","","museounamhoy@gmail.com","IISUE_UNAM",-99.13173,19.43367,"http://sic.gob.mx/ficha.php?table=museo&table_id=1893","2021-03-08 04:14:32-06"
692,"Museo de Geología","Ciencia y tecnología","1904-09-06","UNAM/Instituto de Geología",9,"Ciudad de México",15,"Cuauhtémoc",1,"Cuauhtémoc","Jaime Torres Bodet 176","Col. Santa María La Ribera","06400","(55) 5547 3900 ext. 106","http://www.geologia.unam.mx/igl/museo/index.html","","contacto.museo@geologia.unam.mx","",-99.15785,19.45018,"http://sic.gob.mx/ficha.php?table=museo&table_id=692","2021-01-20 04:41:06-06"
1473,"Museo del Tequila y el Mezcal (MUTEM)","Especializado","2010-12-11","Integradora de Culturas y Raíces Mexicanas, S.A. de C.V.",9,"Ciudad de México",15,"Cuauhtémoc",1,"Cuauhtémoc"," Eje Central Lázaro Cárdenas s/n","Centro","06010","55 5526 6540","http://www.mutemgaribaldi.mx","","info@mutemgaribaldi.mx","mutemgaribaldi",-99.13946,19.44057,"http://sic.gob.mx/ficha.php?table=museo&table_id=1473","2021-03-05 05:29:56-06"
1519,"Museo de la Cancillería","Arte","2011-11-15","Secretaría de Relaciones Exteriores",9,"Ciudad de México",15,"Cuauhtémoc",1,"Cuauhtémoc","República del Salvador 47 ","Centro","06000","(55) 3686 5100 ext. 8327","","","museodelacancilleria@sre.gob.mx","",-99.13838,19.42969,"http://sic.gob.mx/ficha.php?table=museo&table_id=1519","2019-10-11 06:56:49-05"
503,"Herbario Medicinal del IMSS","Antropología","1978-06-01","Instituto Mexicano del Seguro Social",9,"Ciudad de México",15,"Cuauhtémoc",1,"Cuauhtémoc","Av. Cuauhtémoc 330","Col. Doctores","66725","(55) 5588 5607","","http://leonardobeltrann.blogspot.mx/2012/04/el-herbario-nacional-de-plantas.html","herbarioimss@yahoo.com.mx","",-99.15325,19.40772,"http://sic.gob.mx/ficha.php?table=museo&table_id=503","2019-10-11 06:40:52-05"
1096,"Museo Interactivo de Economía (MIDE)","Ciencia y tecnología","2006-07-12","Fideicomiso del Espacio Cultural y Educativo Betlemitas",9,"Ciudad de México",15,"Cuauhtémoc",1,"Cuauhtémoc","Tacuba 17","Centro","06000","55 5130 4600 ext. 2900","http://www.mide.org.mx/","","atencion.publico@mide.org.mx; direccion.general@mide.org.mx; relaciones.publicas@mide.org.mx","MuseoMIDE",-99.13842,19.43516,"http://sic.gob.mx/ficha.php?table=museo&table_id=1096","2021-03-05 06:14:00-06"
759,"Museo del Policía de la Ciudad de México","Historia","1991-07-15","Secretaría de Seguridad Pública de la Ciudad de México",9,"Ciudad de México",15,"Cuauhtémoc",1,"Cuauhtémoc","Victoria 82","Centro Histórico","06010","55 5518 7693","","","museodelpolicia@gmail.com","",-99.14657,19.43207,"http://sic.gob.mx/ficha.php?table=museo&table_id=759","2021-07-13 08:30:38-05"
2067,"Museo Salón de Cabildos del Antiguo Palacio del Ayuntamiento","","2018-12-05","Secretaría de Cultura de la Ciudad de México/Museo de la Ciudad de México",9,"Ciudad de México",15,"Cuauhtémoc",1,"Cuauhtémoc","Antiguo Palacio del Ayuntamiento<br>Plaza de la Constitución 2","Centro Histórico","06000","55 5345 8000","https://www.cultura.cdmx.gob.mx/recintos/museos/salon-de-cabildos","","salondecabildos1@gmail.com","",-99.13404,19.43162,"http://sic.gob.mx/ficha.php?table=museo&table_id=2067","2020-04-27 09:07:57-05"
797,"Museo de la Ciudad de México","Arte","1964-10-31","Secretaría de Cultura de la Ciudad de México",9,"Ciudad de México",15,"Cuauhtémoc",1,"Cuauhtémoc","José María Pino Suárez 30","Centro Histórico","06060","55 5522 9936","https://www.cultura.cdmx.gob.mx/recintos/mcm","","museodelaciudaddemexico@gmail.com","museomexico",-99.13236,19.42895,"http://sic.gob.mx/ficha.php?table=museo&table_id=797","2021-03-05 04:31:36-06"
1176,"Museo Panteón de San Fernando (cerrado por restauración)","Historia","2006-07-18","Secretaría de Cultura de la Ciudad de México",9,"Ciudad de México",15,"Cuauhtémoc",1,"Cuauhtémoc","Plaza San Fernando 17","Col. Guerrero","06300","55 5518 4736","https://www.cultura.cdmx.gob.mx/recintos/mpsf","https://www.facebook.com/museopanteondesanfernandosecretariadeculturagdf/info","museopanteonsanfernando@hotmail.com","",-99.14826,19.43911,"http://sic.gob.mx/ficha.php?table=museo&table_id=1176","2020-04-22 05:14:02-05"
1109,"Museo Archivo de la Fotografía (MAF)","Arte","2006-12-12","Secretaría de Cultura de la Ciudad de México",9,"Ciudad de México",15,"Cuauhtémoc",1,"Cuauhtémoc","República de Guatemala 34-38","Centro Histórico","06010","55 2616 7057","https://mafmuseo.wordpress.com/","","museoarchivofotografia@gmail.com","MAFmuseo",-99.13214,19.43486,"http://sic.gob.mx/ficha.php?table=museo&table_id=1109","2021-03-04 04:57:20-06"
476,"Museo de Sitio del Templo Mayor","Arqueología","1987-10-12","Secretaría de Cultura/INAH",9,"Ciudad de México",15,"Cuauhtémoc",1,"Cuauhtémoc","Seminario 8","Centro Histórico","06060","55 4040 5600 exts. 412930, 412933","http://www.inah.gob.mx/red-de-museos/292-museo-de-sitio-del-templo-mayor","https://www.templomayor.inah.gob.mx/","difusion.mntm@inah.gob.mx","mustemplomayor",-99.13101,19.43498,"http://sic.gob.mx/ficha.php?table=museo&table_id=476","2020-02-19 08:18:15-06"
661,"Museo Mural Diego Rivera","Arte","1988-02-19","Secretaría de Cultura/INBA",9,"Ciudad de México",15,"Cuauhtémoc",1,"Cuauhtémoc","Balderas s/n esq. Colón","Centro Histórico","06040","55  1555 1900","https://museomuraldiegorivera.bellasartes.gob.mx/","","mmdr.informes@inba.gob.mx","MuseoMural",-99.14685,19.43604,"http://sic.gob.mx/ficha.php?table=museo&table_id=661","2021-03-05 07:32:46-06"
1491,"Museo de Sitio de Tlatelolco Caja de Agua","Arqueología","2011-12-15","Secretaría de Cultura/INAH",9,"Ciudad de México",15,"Cuauhtémoc",1,"Cuauhtémoc","Eje Central Lázaro Cárdenas s/n","Unidad Habitacional Nonoalco-Tlatelolco, Tercera Sección","06900","55 5782 2240","https://lugares.inah.gob.mx/lugar-456-es","","za.tlatelolco@inah.gob.mx; edwina_villegas@inah.gob.mx","",-99.13731,19.45108,"http://sic.gob.mx/ficha.php?table=museo&table_id=1491","2020-03-02 05:43:19-06"
1080,"Museo del Palacio de Bellas Artes ","Arte","1934-09-29","Secretaría de Cultura/INBA",9,"Ciudad de México",15,"Cuauhtémoc",1,"Cuauhtémoc","Av. Juárez s/n esq. Eje Central Lázaro Cárdenas","Centro Histórico","06050","55 1000 4622 ext. 2132, 2155","http://museopalaciodebellasartes.gob.mx/","","gpba.palaciodebellasrtes@inba.gob.mx; mpba.informes@inba.gob.mx","mbellasartes",-99.14129,19.43515,"http://sic.gob.mx/ficha.php?table=museo&table_id=1080","2021-03-05 05:16:55-06"
427,"Laboratorio Arte Alameda","Arte","2000-01-01","Secretaría de Cultura/INBA",9,"Ciudad de México",15,"Cuauhtémoc",1,"Cuauhtémoc","Calle Dr. Mora 7","Centro Histórico","06050","55 8647 5660","http://www.artealameda.bellasartes.gob.mx/","","info.artealameda@gmail.com","ArteAlameda",-99.14667,19.43632,"http://sic.gob.mx/ficha.php?table=museo&table_id=427","2021-03-04 04:44:56-06"
970,"Museo del Caracol, Galería de Historia","Historia","1960-11-01","Secretaría de Cultura/INAH",9,"Ciudad de México",16,"Miguel Hidalgo",1,"Miguel Hidalgo","Rampa de acceso al Castillo de Chapultepec s/n","Col. San Miguel Chapultepec,  1ra. sección","11580","55 4040  5241 ,  55 4040   5247","http://www.inah.gob.mx/es/red-de-museos/264-museo-del-caracol-galeria-de-historia","","gale_historia.museo@inah.gob.mx","",-99.1833,19.41895,"http://sic.gob.mx/ficha.php?table=museo&table_id=970","2020-04-23 08:29:12-05"
1478,"Museo Soumaya, Plaza Carso","Arte","2011-03-28","Fundación Carlos Slim, A.C.",9,"Ciudad de México",16,"Miguel Hidalgo",1,"Miguel Hidalgo","Blvd. Miguel de Cervantes Saavedra 303","Col. Ampl. Granada","11529","(55) 1103 9801, 9802 y 9803","http://www.soumaya.com.mx/index.php/esp","","museo@soumaya.org.mx","ElMuseoSoumaya",-99.20462,19.44066,"http://sic.gob.mx/ficha.php?table=museo&table_id=1478","2020-06-30 08:58:32-05"
548,"Museo Casa de la Bola","Arte","1991-05-27","Fundación Cultural Antonio Haghenbeck de la Lama, I.A.P.",9,"Ciudad de México",16,"Miguel Hidalgo",1,"Miguel Hidalgo","Av. Parque Lira 136","Col. Tacubaya","11860","55 2614 0164","http://www.museoshaghenbeck.mx/","https://www.facebook.com/museoshaghenbeck.mx","newsletter@museoshaghenbeck.mx","",-99.18843,19.4047,"http://sic.gob.mx/ficha.php?table=museo&table_id=548","2021-03-04 05:01:52-06"
478,"La Casa Luis Barragán","Arte","1998-10-20","Fundación de Arquitectura Tapatía Luis Barragán, A.C.",9,"Ciudad de México",16,"Miguel Hidalgo",1,"Miguel Hidalgo","Gral. Francisco Ramírez 14-16","Col. Ampliación Daniel Garza","11840","(55) 5272 4945","http://www.casaluisbarragan.org","","casaluisbarragan@gmail.com","Casa_Barragan",-99.19241,19.4111,"http://sic.gob.mx/ficha.php?table=museo&table_id=478","2019-07-30 06:14:56-05"
238,"Museo de Historia Natural y Cultura Ambiental","Ciencia y tecnología","1964-10-24","Gobierno de la Ciudad de México/Secretaría del Medio Ambiente",9,"Ciudad de México",16,"Miguel Hidalgo",1,"Miguel Hidalgo","Av. de los Compositores s/n","Col. Bosque de Chapultepec II sección","11800","(55) 5515 0739 ext. 112 y 113","http://data.sedema.cdmx.gob.mx/museodehistorianatural/?view=featured","","eventosmhnca@sedema.cdmx.gob.mx","",-99.20165,19.40959,"http://sic.gob.mx/ficha.php?table=museo&table_id=238","2021-01-20 05:39:01-06"
1614,"Museo de Geofísica","Ciencia y tecnología","2010-09-10","UNAM/Instituto de Geofísica",9,"Ciudad de México",16,"Miguel Hidalgo",1,"Miguel Hidalgo","Victoriano Zepeda 53","Col. Observatorio","11860","55 5271 1068 ","https://www.geofisica.unam.mx/museos.html","","museo@geofisica.unam.mx","",-99.19543,19.40487,"http://sic.gob.mx/ficha.php?table=museo&table_id=1614","2021-03-04 06:34:27-06"
1874,"Museo del Centenario del Ejército Mexicano","Historia","2013-11-19","Secretaría de la Defensa Nacional (SEDENA)",9,"Ciudad de México",16,"Miguel Hidalgo",1,"Miguel Hidalgo","Blvd. Manuel Ávila Camacho esq. Av. Industria Militar","Col. Lomas de Sotelo","11200","55 2122 8800 ext. 8808","http://www.gob.mx/sedena/acciones-y-programas/museo-del-centenario-del-ejercito-mexicano","","","",-99.21577,19.44041,"http://sic.gob.mx/ficha.php?table=museo&table_id=1874","2020-04-21 09:56:44-05"
2194,"Cencalli: Casa del Maíz y la Cultura Alimentaria","","2021-09-29","Gobierno de México/Secretaría de Cultura/Gobierno de la Ciudad de México",9,"Ciudad de México",16,"Miguel Hidalgo",1,"Miguel Hidalgo","","Col. Bosque de Chapultepec, 1a. Sección.","11850","55 4155 0200 ext. 2412","https://chapultepec.cultura.gob.mx/oferta-cultural/los-pinos/cencalli/","","contactolospinos@cutura.gob.mx","",-99.192,19.41717,"http://sic.gob.mx/ficha.php?table=museo&table_id=2194","2021-09-28 07:26:37-05"
2180,"Museo Nacional de Energía y Tecnología (Munet) (en proceso de remodelación)","","1000-01-01","",9,"Ciudad de México",16,"Miguel Hidalgo",1,"Miguel Hidalgo","Av. Grande del Bosque s/n","2da. sección del Bosque de Chapultepec","11870","55 5516 0964","https://www.gob.mx/gobmx/articulos/conoce-como-sera-el-nuevo-museo-nacional-de-energia-y-tecnologia-munet?fbclid=IwAR2czs8VUHq-0B98NCTmlXxj60fnVs9vTesT2fNNg6yIaOo5xVzsdLDSvXc","https://www.facebook.com/groups/185639578147807/?post_id=1083050298406726","","",-99.19056,19.40727,"http://sic.gob.mx/ficha.php?table=museo&table_id=2180","2020-09-01 06:51:09-05"
335,"Museo Tamayo Arte Contemporáneo","Arte","1981-05-30","Secretaría de Cultura/INBA",9,"Ciudad de México",16,"Miguel Hidalgo",1,"Miguel Hidalgo","Paseo de la Reforma 51 esq. Gandhi","Col. Bosque de Chapultepec","11580","55 4122 8200","http://www.museotamayo.org","","info@museotamayo.org ","museotamayo",-99.18173,19.42552,"http://sic.gob.mx/ficha.php?table=museo&table_id=335","2021-03-08 04:27:17-06"
2166,"Museo de la Brigada de Fusileros Paracaidistas","","2015-10-03","Secretaría de la Defensa Nacional",9,"Ciudad de México",16,"Miguel Hidalgo",1,"Miguel Hidalgo","Av. Conscripto s/n, P-3 Campo Militar 1-A ","Col. Lomas de Sotelo    ","11619","55 539 59 57 ext. 1602	","https://www.gob.mx/sedena/acciones-y-programas/museos-y-bibliotecas-9853","","cmte.bfp@sedena.gob.mx ","",-99.2264,19.44185,"http://sic.gob.mx/ficha.php?table=museo&table_id=2166","2020-04-27 09:13:47-05"
1232,"Museo de Caballería","Historia","2006-04-16","Secretaría de la Defensa Nacional (SEDENA)/Dirección General de Archivo e Historia",9,"Ciudad de México",16,"Miguel Hidalgo",1,"Miguel Hidalgo","Av. México Tacuba, Campo Militar 1-B","Col. Popotla","11411","(55) 5396 5975","http://www.gob.mx/sedena/acciones-y-programas/museo-de-caballeria","","mus_cab@mail.sedena.gob.mx","",-99.17576,19.45087,"http://sic.gob.mx/ficha.php?table=museo&table_id=1232","2019-03-14 09:00:17-06"
673,"Museo Nacional de Historia Castillo de Chapultepec (cerrado temporalmente por covid)","Historia","1944-09-27","Secretaría de Cultura/INAH",9,"Ciudad de México",16,"Miguel Hidalgo",1,"Miguel Hidalgo","Primera Sección del Bosque de Chapultepec s/n","Col. San Miguel Chapultepec","11580","55 4040 5214","https://mnh.inah.gob.mx/","http://www.inah.gob.mx/red-de-museos/295-museo-nacional-de-historia-castillo-de-chapultepec","difusion.mnh@inah.gob.mx, salvador_rueda@inah.gob.mx","Museodehistoria",-99.18204,19.42036,"http://sic.gob.mx/ficha.php?table=museo&table_id=673","2021-05-05 06:30:26-05"
502,"Maná, Museo de la Biblia","Historia","2000-07-30","Maná, Museo de las Sagradas Escrituras, A.C.",9,"Ciudad de México",16,"Miguel Hidalgo",1,"Miguel Hidalgo","Tonantzin 31","Col. Tlaxpana","11370","(55) 5591 0139","http://www.museodelabiblia.mx","","info@museodelabiblia.mx","",-99.16894,19.44334,"http://sic.gob.mx/ficha.php?table=museo&table_id=502","2020-04-27 08:24:51-05"
2064,"Museo de Sitio y Centro de Visitantes del Bosque de Chapultepec","","2018-11-14","SEDEMA/Dirección de Gestión del Bosque de Chapultepec",9,"Ciudad de México",16,"Miguel Hidalgo",1,"Miguel Hidalgo","General Miguel Hidalgo s/n","1a. Sección del Bosque de Chapultepec","11850","55 5925 4372","https://chapultepec.org.mx/actividad/museo-de-sitio-y-centro-de-visitantes/","","museodesitiobch@gmail.com","",-99.17926,19.42095,"http://sic.gob.mx/ficha.php?table=museo&table_id=2064","2021-06-29 06:36:10-05"
786,"Sala de Arte Público Siqueiros","Arte","1969-01-29","Secretaría de Cultura/INBA",9,"Ciudad de México",16,"Miguel Hidalgo",1,"Miguel Hidalgo","Tres Picos 29","Col. Polanco","11560","55 8647 5340 y 43","http://saps-latallera.org/","","saps.difusion@inba.gob.mx","",-99.18736,19.42875,"http://sic.gob.mx/ficha.php?table=museo&table_id=786","2021-03-08 03:43:55-06"
911,"Mapoteca Manuel Orozco y Berra (MOB)","Especializado","1977-01-01","Servicio de Información Agroalimentaria y Pesquera, Secretaría de Agricultura Ganadería Desarrollo Rural Pesca y Alimentación",9,"Ciudad de México",16,"Miguel Hidalgo",1,"Miguel Hidalgo","Av. Observatorio 192","Col. Observatorio","11860","55 3871 8500 exts. 48147, 48205, 48206","http://mapoteca.siap.gob.mx/","","mmoyb@siap.gob.mx","",-99.19625,19.40351,"http://sic.gob.mx/ficha.php?table=museo&table_id=911","2020-04-23 08:49:13-05"
977,"Museo Nacional de la Cartografía","Historia","2000-02-19","Secretaría de la Defensa Nacional (SEDENA)/Dirección General de Archivo e Historia",9,"Ciudad de México",16,"Miguel Hidalgo",1,"Miguel Hidalgo","Av. Observatorio 94","Col. Tacubaya","11870","(55) 5272 6686","http://www.gob.mx/sedena/acciones-y-programas/museo-nacional-de-la-cartografia","","mus_carto@mail.sedena.gob.mx ","",-99.19191,19.40427,"http://sic.gob.mx/ficha.php?table=museo&table_id=977","2019-03-28 08:09:42-06"
2181,"Museo Casa Presidencial Lázaro Cárdenas","","2020-10-19","Secretaría de Cultura del Gobierno de México",9,"Ciudad de México",16,"Miguel Hidalgo",1,"Miguel Hidalgo","Complejo Cultural Los Pinos","Col. San Miguel Chapultepec, 1ra sección","11850","55 41550200 ext. 2412","https://www.gob.mx/cultura/prensa/abre-al-publico-el-museo-casa-presidencial-lazaro-cardenas-espacio-de-memoria-y-documento?idiom=es","","","",-99.19056,19.40727,"http://sic.gob.mx/ficha.php?table=museo&table_id=2181","2020-10-21 09:26:21-05"
807,"Museo Nacional de Antropología ","Antropología","1964-09-17","Secretaría de Cultura/INAH",9,"Ciudad de México",16,"Miguel Hidalgo",1,"Miguel Hidalgo","Av. Paseo de la Reforma esq. Calz. Gandhi s/n ","Col. Chapultepec Polanco ","11560","55 4040 5300 ","https://www.mna.inah.gob.mx/","https://es-la.facebook.com/MuseoNacionaldeAntropologiaOficial/","atencion.mna@inah.gob.mx; promocion_cultural@inah.gob.mx","mna_inah",-99.18695,19.42603,"http://sic.gob.mx/ficha.php?table=museo&table_id=807","2020-11-16 04:11:54-06"
658,"Museo de Arte Moderno (MAM)","Arte","1964-09-20","Secretaría de Cultura/INBA",9,"Ciudad de México",16,"Miguel Hidalgo",1,"Miguel Hidalgo","Paseo de la Reforma y Gandhi s/n","Bosque de Chapultepec","11560","55 8647 5530","https://mam.inba.gob.mx/","https://www.facebook.com/pg/MuseodeArteModernoMX/about/?ref=page_internal","info@mam.org.mx","museoAmodernoMX",-99.17976,19.42291,"http://sic.gob.mx/ficha.php?table=museo&table_id=658","2020-05-06 06:25:22-05"
375,"Papalote Museo del Niño Chapultepec","Ciencia y tecnología","1996-11-01","Museo Interactivo Infantil, A.C. ",9,"Ciudad de México",16,"Miguel Hidalgo",1,"Miguel Hidalgo","Av. Constituyentes 268","Col. Daniel Garza, 2da. Sección del Bosque de Chapultepec","11830","(55) 5237 1781","https://www.papalote.org.mx/","","","Papalote_Museo",-99.19455,19.41152,"http://sic.gob.mx/ficha.php?table=museo&table_id=375","2021-09-21 05:35:13-05"
1484,"Museo Jumex","Arte","2013-11-19","Fundación Jumex Arte Contemporáneo, A.C.",9,"Ciudad de México",16,"Miguel Hidalgo",1,"Miguel Hidalgo","Blvd. Miguel de Cervantes Saavedra 303","Col. Granada","11520","55 5395 2618","https://www.fundacionjumex.org/es","","info@fundacionjumex.org","Coleccion_Jumex",-99.20367,19.44041,"http://sic.gob.mx/ficha.php?table=museo&table_id=1484","2020-04-20 12:27:19-05"
975,"Museo Legislativo Los Sentimientos de la Nación","Historia","1994-10-24","H. Cámara de Diputados/Dirección General de Servicios de Documentación , Información y Análisis",9,"Ciudad de México",17,"Venustiano Carranza",1,"Venustiano Carranza","Av. Congreso de la Unión 66","Col. El Parque","15960","55 5036 0000 ext. 55088","http://museolegislativo.diputados.gob.mx/","","visitas.guiadas@diputados.gob.mx","",-99.1179,19.42967,"http://sic.gob.mx/ficha.php?table=museo&table_id=975","2021-03-05 06:32:36-06"
1227,"Sala de Exposiciones de la Terminal 2 del Aeropuerto Internacional de la Ciudad de México Benito Juárez","Arqueología","2008-04-08","Secretaría de Cultura/INAH",9,"Ciudad de México",17,"Venustiano Carranza",1,"Venustiano Carranza","Av. Capitán Carlos León s/n entre las puertas 5 y 6","Col. Peñón de los Baños","15620","55 2482 2550, 55 2598 7000","http://www.inah.gob.mx/red-de-museos/269-sala-de-exposiciones-de-la-terminal-2-del-aeropuerto-internacional-de-la-ciudad-de-mexico-benito-juarez","","vcolins@aicm.com.mx","",-99.07831,19.42202,"http://sic.gob.mx/ficha.php?table=museo&table_id=1227","2021-03-24 06:00:01-06"
224,"Museo Profr. Enrique W. Sánchez García","Arqueología","2000-02-17","Unión de Museos Comunitarios del Estado de Durango, A.C.",10,"Durango",1,"Canatlán",1,"Canatlán","Av. Soledad Álvarez s/n","Col. San Diego","34456","(677) 872 13 62 ","","","claudiaderetana@hotmail.com","",-104.7782,24.52353,"http://sic.gob.mx/ficha.php?table=museo&table_id=224","2017-02-28 13:21:28-06"
406,"Museo Comunitario Kokopelli","Arqueología","2008-06-21","Unión de Museos Comunitarios del Estado de Durango, A.C.",10,"Durango",1,"Canatlán",52,"Gomelia","Domicilio conocido","Centro","34448","(618) 139 32 51","","","felixporras55@live.com.mx","",-105.23114,24.55189,"http://sic.gob.mx/ficha.php?table=museo&table_id=406","2017-03-03 12:28:35-06"
400,"Museo Comunitario Concuemitl","Historia","1994-08-04","Ayuntamiento de Cuencamé",10,"Durango",4,"Cuencamé",1,"Cuencamé de Ceniceros","Constitución 109, Quiosco de la Plaza de Armas","Centro","35800","(671) 763 01 37","","","","",-103.69833,24.87049,"http://sic.gob.mx/ficha.php?table=museo&table_id=400","2015-07-06 11:06:42-05"
1911,"Museo Comunitario Gral. Calixto Contreras","Historia","2015-01-01","Unión de Museos Comunitarios del Estado de Durango, A.C.",10,"Durango",4,"Cuencamé",64,"San Pedro de Ocuila","Domicilio conocido","","35805","Cel. (671) 107 32 47","","","anacleto_hdez65@hotmail.com","",0,0,"http://sic.gob.mx/ficha.php?table=museo&table_id=1911","2017-03-02 10:14:21-06"
983,"Museo Comunitario de Velardeña","Historia","1996-10-14","Unión de Museos Comunitarios del Estado de Durango, A.C.",10,"Durango",4,"Cuencamé",74,"Velardeña","Ferrocarril 8","Col. El Ocho","35816","(671) 763 11 57","","","carmen_lujan_orozco@hotmail.com","",-103.73833,25.06472,"http://sic.gob.mx/ficha.php?table=museo&table_id=983","2014-02-06 05:54:11-06"
1485,"Museo de Historia y Arte Contemporáneo El Palacio de los Gurza","Arte","2010-09-15","Instituto de Cultura del Estado de Durango",10,"Durango",5,"Durango",1,"Victoria de Durango","Negrete 901 Pte.","Centro","34000","(618) 811 17 20","http://museogurza.iced.durango.gob.mx/","","museopalaciodelosgurza@gmail.com","",-104.67235,24.02517,"http://sic.gob.mx/ficha.php?table=museo&table_id=1485","2021-01-21 04:26:42-06"
297,"Museo de Arqueología Ganot-Peschard","Arqueología","1998-03-03","Instituto de Cultura del Estado de Durango",10,"Durango",5,"Durango",1,"Victoria de Durango","Zaragoza 315 Sur","Centro Histórico","34000","(618) 813 10 47","http://museoganotpeschard.iced.durango.gob.mx/","","museo.arqueologiagp@gmail.com","",-104.67192,24.02378,"http://sic.gob.mx/ficha.php?table=museo&table_id=297","2021-01-21 03:15:55-06"
994,"Museo Regional de Durango Ángel Rodríguez Solórzano","Historia","1988-11-26","Universidad Juárez del Estado de Durango",10,"Durango",5,"Durango",1,"Victoria de Durango","Calle Victoria 100 Sur s/n esq. Aquiles Serdán","Centro","34000","(618) 813 10 94","http://www.museo.ujed.mx","","museoregional@hotmail.com","",-104.66982,24.02648,"http://sic.gob.mx/ficha.php?table=museo&table_id=994","2021-09-30 08:46:19-05"
1346,"Museo de Arte Funerario Benigno Montoya","Arte","2002-12-27","Ayuntamiento de Durango, Instituto Municipal del Arte y la Cultura ",10,"Durango",5,"Durango",1,"Victoria de Durango","Prol. Pino Suárez s/n, Panteón Municipal de Oriente","Col. Hipódromo","34000","(618) 137 84 90","http://imac.municipiodurango.gob.mx/","","imacdgo.comunicacion@gmail.com","",-104.64151,24.02701,"http://sic.gob.mx/ficha.php?table=museo&table_id=1346","2016-06-13 12:16:22-05"
897,"Museo de las Culturas Populares de Durango","Arte","1995-10-04","Instituto de Cultura del Estado de Durango",10,"Durango",5,"Durango",1,"Victoria de Durango","5 de Febrero 1107 Pte.","Centro Histórico","34000","(618) 825 88 27","","","museoculturapop@hotmail.com","",-104.67455,24.02242,"http://sic.gob.mx/ficha.php?table=museo&table_id=897","2019-02-06 06:36:04-06"
