museo_id,museo_nombre,museo_tematica_n1,museo_fecha_fundacion,museo_adscripcion,estado_id,nom_ent,municipio_id,nom_mun,localidad_id,nom_loc,museo_calle_numero,museo_colonia,museo_cp,museo_telefono1,pagina_web,pagina_web2,email,twitter,gmaps_longitud,gmaps_latitud,link_sic,fecha_mod
371,"Museo  de la Evangelización Ex Convento de San Miguel Arcángel","Historia","1981-01-01","Secretaría de Cultura/INAH",21,"Puebla",74,"Huejotzingo",1,"Huejotzingo","Plazuela de San Francisco s/n","Centro","74160","(227) 276 02 28","","https://mediateca.inah.gob.mx/repositorio/islandora/object/museo%3A1420"," gabriel_maritano@inah.gob.mx","",-98.4043,19.15871,"http://sic.gob.mx/ficha.php?table=museo&table_id=371","2020-10-12 08:51:32-05"
142,"Museo Comunitario Ixtacamaxtitlán","Arqueología","1993-10-15","Comunitario independiente",21,"Puebla",83,"Ixtacamaxtitlán",1,"Ixtacamaxtitlán","Av. Reforma s/n","Centro","73720","(797) 975 41 47","","","","",-97.81661,19.62343,"http://sic.gob.mx/ficha.php?table=museo&table_id=142","2019-04-17 07:52:12-05"
2152,"Museo Casa de Cultura de Izúcar","Arqueología","2014-10-29","H. Ayuntamiento de Izúcar de Matamoros",21,"Puebla",85,"Izúcar de Matamoros",1,"Izúcar de Matamoros","Ayuntamiento Norte 10","Centro","74400","2434364611","http://museu.ms/museum/details/17748/museo-de-sitio-casa-de-cultura-izcar","","","",-98.46528,18.60223,"http://sic.gob.mx/ficha.php?table=museo&table_id=2152","2019-07-12 11:49:32-05"
2054,"Museo Regional de Telecomunicaciones Juan de la Granja","","1000-01-01","",21,"Puebla",104,"Nopalucan",1,"Nopalucan de la Granja","Ayuntamiento 206","Centro","75120","(276) 474 0358","","","","",-97.82367,19.21567,"http://sic.gob.mx/ficha.php?table=museo&table_id=2054","2019-04-17 07:44:40-05"
143,"Museo Comunitario Xipixtla","Historia","2002-09-28","Consejo Nacional de Fomento Educativo",21,"Puebla",113,"Piaxtla",6,"Progreso","Domicilio conocido s/n ","Centro","74889","(275) 441 91 01","","","","",-98.25283,18.19755,"http://sic.gob.mx/ficha.php?table=museo&table_id=143","2019-04-17 07:47:22-05"
1655,"Museo Interactivo 5 de Mayo","Historia","2012-05-04","Consejo Estatal para la Cultura y las Artes de Puebla",21,"Puebla",114,"Puebla",1,"Heroica Puebla de Zaragoza","Ejército de Oriente s/n y Unidad Cívica 5 de Mayo","Col. Moctezuma","72260","(222) 232 15 28","","","zaragoza@5demayopuebla.mx","",-98.18041,19.05487,"http://sic.gob.mx/ficha.php?table=museo&table_id=1655","2019-11-20 07:13:45-06"
166,"Museo Amparo","Arqueología","1991-02-28","Fundación Amparo",21,"Puebla",114,"Puebla",1,"Heroica Puebla de Zaragoza","Av. 2 Sur 708 ","Centro Histórico","72000","(222) 229 38 50, 229 38 57","http://www.museoamparo.com/","","difusion.amparo@gmail.com","https://twitter.com/MuseoAmparo",-98.19851,19.04054,"http://sic.gob.mx/ficha.php?table=museo&table_id=166","2020-06-21 14:32:29-05"
1768,"Museo del Ejército y Fuerza Aérea Mexicanos","Historia","2014-11-18","Secretaría de la Defensa Nacional (SEDENA)",21,"Puebla",114,"Puebla",1,"Heroica Puebla de Zaragoza","Calle 13 Sur núm. 103","Centro","72000","(222) 232 26 45","https://www.gob.mx/sedena/acciones-y-programas/museo-del-ejercito-y-fuerza-aerea-mexicanos-puebla-pue","","","",-98.20793,19.04843,"http://sic.gob.mx/ficha.php?table=museo&table_id=1768","2019-04-17 09:03:43-05"
1664,"Museo Biblioteca Palafoxiana ","TND","1981-01-01","Secretaría de Cultura y Turismo de Puebla",21,"Puebla",114,"Puebla",1,"Heroica Puebla de Zaragoza","5 Oriente 5","Centro Histórico","72000","(222) 232 34 83","","","biblioteca.palafoxiana@gmail.com","",-98.19879,19.04225,"http://sic.gob.mx/ficha.php?table=museo&table_id=1664","2021-07-30 03:01:53-05"
1804,"Museo de la Evolución Puebla","Ciencia y tecnología","2016-01-15","Secretaría de Cultura y Turismo del Gobierno del Estado de Puebla",21,"Puebla",114,"Puebla",1,"Heroica Puebla de Zaragoza","Calz. Ejército de Oriente s/n esq Cazadores de Morelia, Plaza Cívica 5 de Mayo","Zona Los Fuertes","72260","(222) 213 02 89","http://museospuebla.puebla.gob.mx/museos/item/8-museo-de-la-evolucion-puebla","","reservaciones.evolucion@gmail.com","EvolucionPuebla",-98.18139,19.05767,"http://sic.gob.mx/ficha.php?table=museo&table_id=1804","2021-07-30 03:35:42-05"
1499,"Museo UPAEP","Arte","1995-02-10","Universidad Popular Autónoma del Estado de Puebla",21,"Puebla",114,"Puebla",1,"Heroica Puebla de Zaragoza","11 Poniente 1914","Barrio de Santiago","72160","(222) 229 94 00  exts. 7810, 7851","http://www.upaep.mx/museo","https://www.facebook.com/upaepmuseo/timeline","museo@upaep.mx","",-98.21541,19.04828,"http://sic.gob.mx/ficha.php?table=museo&table_id=1499","2019-04-17 09:51:00-05"
337,"Planetario de Puebla Germán Martínez Hidalgo","Ciencia y tecnología","1985-02-10","Consejo de Ciencia y Tecnología del Estado de Puebla",21,"Puebla",114,"Puebla",1,"Heroica Puebla de Zaragoza","Calz. Ejército de Oriente s/n esq. Cazadores de Morelia","Zona de los Fuertes, Unidad Cívica 5 de Mayo","72260","(222) 236 69 98","https://imagenpoblana.com/18/03/11/planetario-german-martinez-hidalgo-en-puebla-la-ciencia-divierte","","planetariopuebla@hotmail.com","",-98.18157,19.05698,"http://sic.gob.mx/ficha.php?table=museo&table_id=337","2019-04-17 10:12:53-05"
1979,"Galería Tesoros de la Catedral de Puebla","","2014-10-28","",21,"Puebla",114,"Puebla",1,"Heroica Puebla de Zaragoza","5 Oriente 5 altos de la casa de cultura ","Centro Histórico","72000","(222) 232 2316","http://www.arquidiocesisdepuebla.mx/index.php/arzobispado/catedral","http://puebla.travel/es/museos/item/galeria-tesoros-de-la-catedral-de-puebla","catedralpue@hotmail.com","",-98.19872,19.04203,"http://sic.gob.mx/ficha.php?table=museo&table_id=1979","2020-06-12 11:59:47-05"
1997,"Museo Interactivo de Talavera Celia","","1000-01-01","Privado",21,"Puebla",114,"Puebla",1,"Heroica Puebla de Zaragoza","Calle Fresno 97- A","Arboledas de Guadalupe","","(222) 235 1891","http://www.museointeractivo.com.mx/","","taller@talaveracelia.com; info@museointeractivo.com.mx","",-98.17696,19.05626,"http://sic.gob.mx/ficha.php?table=museo&table_id=1997","2019-04-17 09:21:45-05"
490,"Museo José Luis Bello y Zetina","Arte","1972-04-16","Fundación José Luis Bello y Zetina",21,"Puebla",114,"Puebla",1,"Heroica Puebla de Zaragoza","5 de Mayo 409","Centro","72000","(222) 232 47 20","http://www.museobelloyzetina.org","","museobellozetina72@hotmail.com","",-98.19744,19.04658,"http://sic.gob.mx/ficha.php?table=museo&table_id=490","2020-06-21 13:56:30-05"
283,"Museo Regional de la Revolución Mexicana, Casa de los Hermanos Serdán","Historia","1960-11-18","Secretaría de Cultura del Gobierno del Estado de Puebla",21,"Puebla",114,"Puebla",1,"Heroica Puebla de Zaragoza","Av. 6 Ote. 206 esq. 2 Nte.","Centro Histórico","72000","222 242 10 76","http://museospuebla.puebla.gob.mx","","museorevolucionmexicana@puebla.gob.mx","PueblaMuseos",-98.19522,19.04578,"http://sic.gob.mx/ficha.php?table=museo&table_id=283","2021-08-18 07:26:35-05"
820,"Museo José Luis Bello y González","Arte","1944-07-21","Consejo Estatal para la Cultura y las Artes del Estado de Puebla",21,"Puebla",114,"Puebla",1,"Heroica Puebla de Zaragoza","3 Pte. 302","Centro Histórico","72000","(222) 232 94 75","","http://museospuebla.puebla.gob.mx/index.php/museos/item/3-museo-jose-luis-bello-y-gonzalez","amhcastillo@yahoo.com.mx ","MuseoBello",-98.20063,19.04463,"http://sic.gob.mx/ficha.php?table=museo&table_id=820","2021-07-08 05:50:36-05"
697,"Museo Taller Erasto Cortés (MUTEC)","Arte","2000-08-31","Secretaría de Cultura y Turismo del Estado de Puebla",21,"Puebla",114,"Puebla",1,"Heroica Puebla de Zaragoza","7 Oriente 4","Centro Histórico","72000","(222) 2321227 ext. 112 y 113","","","museoerastocortes@gmail.com; kalejandra782@yahoo.com.mx","",-98.19887,19.04166,"http://sic.gob.mx/ficha.php?table=museo&table_id=697","2021-07-08 05:58:44-05"
1894,"Museo de la Música Mexicana Rafael Tovar y de Teresa","Arte","2016-12-21","Secretaría de Cultura y Turismo del Gobierno del Estado de Puebla",21,"Puebla",114,"Puebla",1,"Heroica Puebla de Zaragoza","Av. Obreros Independientes s/n, esq. 15 Sur Ex-Fábrica La Constancia Mexicana","Luz Obrera","72110","(222) 224 1595","","","complejolaconstancia@gmail.com","ConstanciaPue",-98.23501,19.09368,"http://sic.gob.mx/ficha.php?table=museo&table_id=1894","2019-04-17 08:44:55-05"
882,"Museo Casa del Deán","Historia","1984-01-01","",21,"Puebla",114,"Puebla",1,"Heroica Puebla de Zaragoza","16 de Septiembre 507","Centro Histórico","72000","(222) 235 40 56","","","francisco_ortiz@inah.gob.mx","CasadelDean",-98.19994,19.04244,"http://sic.gob.mx/ficha.php?table=museo&table_id=882","2021-07-30 03:12:44-05"
1588,"Museo del Tecnológico de Monterrey","Arte","2012-03-22","Tecnológico de Monterrey, Campus Puebla",21,"Puebla",114,"Puebla",1,"Heroica Puebla de Zaragoza","4 Norte núm. 5","Centro Histórico","72000","(222) 232 19 20","http://www.pue.itesm.mx/museo/historia.php","","museotec.pue@itesm.mx","MuseoTecdeMty",-98.19539,19.04336,"http://sic.gob.mx/ficha.php?table=museo&table_id=1588","2019-04-17 09:14:59-05"
319,"Museo Universitario Casa de los Muñecos","Arte","1983-12-11","Benemérita Universidad Autónoma de Puebla",21,"Puebla",114,"Puebla",1,"Heroica Puebla de Zaragoza","2 Nte. 2","Centro Histórico","72000","(222) 246 28 99","http://cmas.siu.buap.mx/portal_pprd/wb/vedc/historia_museo_universitario_casa_de_los_munecos","https://www.facebook.com/museouniversitariocasadelosmunecos/","museocasadelosmunecos@correo.buap.mx","",-98.19673,19.04364,"http://sic.gob.mx/ficha.php?table=museo&table_id=319","2019-07-26 05:59:12-05"
1209,"Museo Viviente  Puebla","Especializado","2012-01-28","Asociación Veterinaria de Reptiles  y Anfibios A.C",21,"Puebla",114,"Puebla",1,"Heroica Puebla de Zaragoza","7 Ote 211","Centro Histórico","72000","(222) 232 50 05"," http://www.museoviviente.com/","https://www.facebook.com/museovivientepuebla","museovivientepuebla@gmail.com","MuseoViviente",-98.19746,19.04072,"http://sic.gob.mx/ficha.php?table=museo&table_id=1209","2019-04-17 09:51:48-05"
1805,"Museo Internacional del Barroco","Arte","2016-02-04","Gobierno del Estado de Puebla",21,"Puebla",114,"Puebla",1,"Heroica Puebla de Zaragoza","Vía Atlixcáyotl 2501","Col. Reserva Territorial Atlixcáyotl","72830","222 326 71 30","","","taquilla@museointernacionaldelbarroco.org","PueblaMuseos",-98.24615,19.01892,"http://sic.gob.mx/ficha.php?table=museo&table_id=1805","2021-08-18 07:26:04-05"
20,"Museo Regional de Puebla","Arqueología","1962-05-01","Secretaría de Cultura/INAH",21,"Puebla",114,"Puebla",1,"Heroica Puebla de Zaragoza","Centro Cívico 5 de Mayo, Av. Ejército de Ote. s/n","Zona Histórica de los Fuertes","72270","222 235 9702 ","http://www.inah.gob.mx/es/red-de-museos/283-museo-regional-de-puebla","","museoregionaldepuebla@inah.gob.mx; claudia_reyes@inah.gob.mx","MUReP_INAH",-98.1826,19.05596,"http://sic.gob.mx/ficha.php?table=museo&table_id=20","2020-02-20 08:26:06-06"
286,"San Pedro Museo de Arte","Historia","1998-06-01","Museos Secretaría de Cultura y Turismo del Estado de Puebla",21,"Puebla",114,"Puebla",1,"Heroica Puebla de Zaragoza","4 Nte. 203","Centro Histórico","72000","(222) 246 66 18","","http://museospuebla.puebla.gob.mx/index.php/museos/item/2-san-pedro-museo-de-arte","museoscecap@hotmail.com","",-98.19529,19.04399,"http://sic.gob.mx/ficha.php?table=museo&table_id=286","2020-10-12 08:59:56-05"
497,"Museo de Arte Religioso Ex Convento de Santa Mónica","Arte","1935-01-01","Secretaría de Cultura/INAH",21,"Puebla",114,"Puebla",1,"Heroica Puebla de Zaragoza","Av. 18 Pte 103","Centro Histórico","72000","222 232 0178","http://www.inah.gob.mx/es/red-de-museos/234-museo-de-arte-religioso-de-santa-monica","","difusionsantamónica@gmail.com","MuseoStaMonica",-98.1951,19.05143,"http://sic.gob.mx/ficha.php?table=museo&table_id=497","2020-06-21 15:16:11-05"
1607,"Museo Fuerte de Guadalupe","Historia","2012-09-08","Secretaría de Cultura/INAH",21,"Puebla",114,"Puebla",1,"Heroica Puebla de Zaragoza","Av. Ejércitos de Oriente s/n, Centro Cívico Cultural 5 de Mayo Los Fuertes","Zona Histórica de los Fuertes","72260","222 234 2009","http://www.inah.gob.mx/red-de-museos/284-fuerte-de-guadalupe","","miguel_diaz@inah.gob.mx; fuertedeguadalupepuebla@gmail.com","",-98.17992,19.05246,"http://sic.gob.mx/ficha.php?table=museo&table_id=1607","2020-02-20 07:53:36-06"
573,"Museo del Automóvil Puebla","Especializado","1996-02-06","Asociación del Automóvil Antiguo Puebla, A.C",21,"Puebla",114,"Puebla",1,"Heroica Puebla de Zaragoza","Av. 3 Sur 1501","Col. El Carmen","72000","(222) 240 71 37","","http://puebla.turista.com.mx/museo+del+automovil-viewarticle-40.html","museoautopuebla@hotmail.com","",-98.20363,19.03981,"http://sic.gob.mx/ficha.php?table=museo&table_id=573","2019-04-17 08:54:48-05"
1802,"Museo Infantil La Constancia Mexicana","Ciencia y tecnología","2015-08-03","CECAP",21,"Puebla",114,"Puebla",1,"Heroica Puebla de Zaragoza","Av. Obreros Independientes s/n, esq. 15 Sur ","Luz Obrera","72110","(222) 235 34 19","http://museospuebla.puebla.gob.mx/index.php/museos/item/museo-infantil-de-la-constancia","http://puebla.travel/es/museos/item/museo-infantil-de-la-constancia-mexicana","complejolaconstancia@gmail.com","",-98.23435,19.09397,"http://sic.gob.mx/ficha.php?table=museo&table_id=1802","2020-06-16 04:59:09-05"
438,"Museo San José María de Yermo y Parres","Historia","2008-07-01","Congregación de Siervas del Sagrado Corazón de Jesús y de los pobres, C.R.",21,"Puebla",114,"Puebla",1,"Heroica Puebla de Zaragoza","12 Norte 2003","Barrio El Alto","72000","(222) 242 18 69 ","http://yermoyparres.org.mx/es/museo/","","ccdyermo@padreyermo.org; jilgueroscantan@hotmail.com","",-98.21011,19.04935,"http://sic.gob.mx/ficha.php?table=museo&table_id=438","2019-04-17 09:39:43-05"
879,"Museo Histórico de la No Intervención, Fuerte de Loreto","Historia","1962-05-01","Secretaría de Cultura/INAH",21,"Puebla",114,"Puebla",1,"Heroica Puebla de Zaragoza","Av. Ejércitos de Oriente s/n, Centro Cívico 5 de Mayo","Col. Los Fuertes","72720","(222) 234 85 13","https://www.inah.gob.mx/red-de-museos/285-museo-del-fuerte-de-loreto","","museofuerte_loreto@inah.gob.mx; ivonne_giles@inah.gob.mx","",-98.1871,19.05766,"http://sic.gob.mx/ficha.php?table=museo&table_id=879","2020-03-30 16:55:32-06"
1796,"Museo Casa del Títere Marionetas Mexicanas","","2015-08-03","Secretaría de Cultura y Turismo del Gobierno del Estado de Puebla",21,"Puebla",114,"Puebla",1,"Heroica Puebla de Zaragoza","Blvd. Esteban de Antuñano 111 ","Luz Obrera","72110","(222) 224 15 95","","https://www.mexicoescultura.com/recinto/68134/complejo-museistico-de-la-constancia-mexicana.html","complejolaconstancia@gmail.com","",-98.23482,19.0925,"http://sic.gob.mx/ficha.php?table=museo&table_id=1796","2021-07-30 03:32:16-05"
1795,"Museo La Casa del Mendrugo","Historia","2013-03-19","Fundación La Casa del Mendrugo, A.C.",21,"Puebla",114,"Puebla",1,"Heroica Puebla de Zaragoza","4 Sur 304","Centro Histórico","72000","(222) 326 80 60","http://www.casadelmendrugo.com/","","info@casadelmendrugo.com","",-98.19624,19.04164,"http://sic.gob.mx/ficha.php?table=museo&table_id=1795","2020-05-21 08:16:57-05"
441,"Museo Nacional de los Ferrocarriles Mexicanos","Historia","1988-05-05","Secretaría de Cultura/Centro Nacional para la Preservación del Patrimonio Cultural Ferrocarrilero",21,"Puebla",114,"Puebla",1,"Heroica Puebla de Zaragoza","Calle 11 Nte. 1005 ","Centro Histórico","72000","(222) 774 01 06","https://museoferrocarrilesmexicanos.gob.mx/","","museoferrocarriles@cultura.gob.mx","https://twitter.com/ferrocarriles",-98.20386,19.0541,"http://sic.gob.mx/ficha.php?table=museo&table_id=441","2020-06-21 16:16:44-05"
1753,"Casa de la Música de Viena en Puebla","Arte","2015-01-13","Secretaría de Cultura y Turismo del Gobierno del Estado de Puebla",21,"Puebla",114,"Puebla",1,"Heroica Puebla de Zaragoza","Av. Obreros Independientes s/n, esq. 15 Sur Ex-Fábrica La Constancia Mexicana","Col. Luz Obrera","72110","(222) 224 1595","","","complejolaconstancia@gmail.com","",-98.23476,19.09254,"http://sic.gob.mx/ficha.php?table=museo&table_id=1753","2021-08-12 10:23:51-05"
296,"Museo de Arte Popular Ex-Convento de Santa Rosa ","Arte","2001-02-15","Consejo Estatal para la Cultura y las Artes de Puebla",21,"Puebla",114,"Puebla",1,"Heroica Puebla de Zaragoza","Calle 3 Nte. núm. 1210","Centro Histórico","72000","(222) 232 77 92","https://www.turismopuebla.es/ex-convento-de-santa-rosa","","","",-98.19736,19.05006,"http://sic.gob.mx/ficha.php?table=museo&table_id=296","2020-06-15 09:52:10-05"
177,"Museo Comunitario Santa Catarina Villanueva","Arqueología","1997-11-01","Consejo Nacional de Fomento Educativo",21,"Puebla",115,"Quecholac",19,"Santa Catarina Villanueva","Domicilio conocido s/n","Centro","","","","","","",-97.6575,18.9554,"http://sic.gob.mx/ficha.php?table=museo&table_id=177","2019-06-25 08:43:47-05"
1900,"Museo Regional de Cholula","Arqueología","2017-01-24","Secretaría de Cultura/INAH",21,"Puebla",119,"San Andrés Cholula",1,"San Andrés Cholula","Calle 14 Pte. 307","San Juan Aquiahuac","72810","(222) 247 72 43","http://visit.puebla.gob.mx/ubicacion/museo-regional-de-cholula/",""," correo@correo.com","",-98.30853,19.06931,"http://sic.gob.mx/ficha.php?table=museo&table_id=1900","2021-02-23 08:54:55-06"
512,"Museo del Agua, Agua para Siempre","Ciencia y tecnología","1999-01-01","Alternativas y Procesos de Participación Social, A.C.",21,"Puebla",124,"San Gabriel Chilac",1,"San Gabriel Chilac","Km. 63 de la autopista Tehuacán Oaxaca, y Carr. San Gabriel Chilac - San Juan Atzingo km. 1","San Gabriel Chilac, Barranca Oxtoyo","75880","(238) 371 25 50","http://www.museodelagua.org.mx","","educacion@alternativas.org.mx","",-97.36123,18.31652,"http://sic.gob.mx/ficha.php?table=museo&table_id=512","2019-04-17 10:18:24-05"
1279,"Museo Hacienda de San Cristóbal Polaxtla","Arte","2002-01-01","Fundación Cultural Antonio Haghenbeck y de la Lama, I.A.P.",21,"Puebla",132,"San Martín Texmelucan",1,"San Martín Texmelucan de Labastida","Prol. Ignacio Zaragoza s/n","El Moral","740000","(248)  484 37 05","http://www.museoshaghenbeck.mx/","","newsletter@museoshaghenbeck.mx","",-98.43824,19.27213,"http://sic.gob.mx/ficha.php?table=museo&table_id=1279","2019-04-17 10:20:34-05"
230,"Museo Comunitario de Tlalancaleca","Arqueología","1976-06-21","Comunitario independiente",21,"Puebla",134,"San Matías Tlalancaleca",1,"San Matías Tlalancaleca","San Matías ","Centro","74110","(248) 481 04 04 (presidencia municipal)","","http://blog.udlap.mx/blog/tag/museo-comunitario-de-san-matias-tlalancaleca/","","",-98.49727,19.32458,"http://sic.gob.mx/ficha.php?table=museo&table_id=230","2019-04-17 10:31:25-05"
1198,"Museo de Sitio de Cholula","Arqueología","1945-12-31","Secretaría de Cultura/INAH",21,"Puebla",140,"San Pedro Cholula",1,"Cholula de Rivadavia","Av. 8 Nte. 2 esq. Av. Morelos, Centro Ceremonial","","72760","222 247 90 81","https://www.inah.gob.mx/red-de-museos/255-museo-de-sitio-de-cholula","","mcruz.pue@inah.gob.mx","",-98.30068,19.05967,"http://sic.gob.mx/ficha.php?table=museo&table_id=1198","2020-03-02 04:09:57-06"
1771,"Museo Casa del Caballero Águila","TND","2015-09-16","Ayuntamiento de San Pedro Cholula",21,"Puebla",140,"San Pedro Cholula",1,"Cholula de Rivadavia","Av. 4 Ote. 1-a","Centro","72760","(222) 777 29 00 ext. 2912","https://www.mexicodestinos.com/lugares/casa-del-caballero-aguila-","","mikebricairegmail.com; alan_aya@hotmail.com","",-98.30597,19.06347,"http://sic.gob.mx/ficha.php?table=museo&table_id=1771","2019-04-17 10:32:14-05"
1449,"Museo Comunitario Hueyotli","Antropología","2006-01-01","Junta Hueyotli",21,"Puebla",151,"Santo Tomás Hueyotlipan",1,"Santo Tomás Hueyotlipan","Plaza Central","Centro","75280","(224) 272 40 98","http://turismoenpuebla.com/portal/art123_Museo_Hueyotli.html","","","",0,0,"http://sic.gob.mx/ficha.php?table=museo&table_id=1449","2019-04-17 10:36:35-05"
1904,"Museo de la Evolución Tehuacán","Ciencia y tecnología","2017-01-30","Secretaría de Cultura y Turismo del Gobierno del Estado de Puebla",21,"Puebla",156,"Tehuacán",1,"Tehuacán","Carr. Federal Puebla-Tehuacan 1211 o Km. 114 San Lorenzo Teotipilco","Col. Manantiales","75855","(222) 213 02 89 ","http://museospuebla.puebla.gob.mx/index.php/museos/item/museo-de-la-evolucion-tehuacan","","museodelaevoluciontehuacan@gmail.com","",-97.44012,18.47765,"http://sic.gob.mx/ficha.php?table=museo&table_id=1904","2019-04-17 10:37:08-05"
856,"Museo del Valle de Tehuacán","Antropología","1967-04-01","Secretaría de Cultura/INAH",21,"Puebla",156,"Tehuacán",1,"Tehuacán","Av. Reforma Nte. 200","Centro","75700","(238) 382 40 45","http://www.inah.gob.mx/red-de-museos/302-museo-del-valle-de-tehuacan","","ferrosurinah@live.com.mx","",-97.39347,18.46616,"http://sic.gob.mx/ficha.php?table=museo&table_id=856","2020-02-18 04:35:24-06"
140,"Museo Comunitario Histórico Cultural Paleontológico (HICUPA)","Arqueología","1990-04-23","Comunitario ",21,"Puebla",156,"Tehuacán",1,"Tehuacán","Juárez Nte. s/n","Centro","75856","921 240 10 54","http://museoscomunitarios.org/puebla.html","","hicupatelox@hotmail.com; recafireyes@hotmail.com; scarrera0@gmail.com","",-97.40038,18.46651,"http://sic.gob.mx/ficha.php?table=museo&table_id=140","2020-12-10 02:44:59-06"
1310,"Museo Hidromineral de Peñafiel","Historia","1980-01-01","Ayuntamiento de Tehuacán",21,"Puebla",156,"Tehuacán",1,"Tehuacán","Av. José García Crespo 2805","Col. San Nicolás Tetitzintla","75710","238 380 35 00","","http://turismoenpuebla.com/portal/art85_Museo_Hidromineral_de_Puebla.html","turismo@tehuacan.com.mx","",-97.40132,18.48239,"http://sic.gob.mx/ficha.php?table=museo&table_id=1310","2021-08-26 10:48:40-05"
1901,"Museo de Sitio y Zona Arqueológica de Tehuacán El Viejo (La Mesa)","Arqueología","2017-01-20","Secretaría de Cultura/INAH",21,"Puebla",156,"Tehuacán",1,"Tehuacán","Camino a San Isidro s/n","San Diego Chalma","75859","","","","maurer3te@yahoo.com.mx","",-97.3504,18.44619,"http://sic.gob.mx/ficha.php?table=museo&table_id=1901","2020-02-18 08:45:30-06"
1208,"Museo Regional Mixteco Tlayúa","Ciencia y tecnología","1989-01-01","UNAM/Instituto de Geología",21,"Puebla",169,"Tepexi de Rodríguez",1,"Tepexi de Rodríguez","Carr. Estatal 709 La Colorada-Coyotepec s/n","Col. Morelos","74692","(224) 421 90 26","http://www.geologia.unam.mx/contenido/museo-regional-mixteco-tlayua","https://www.facebook.com/pages/El-Museo-Regional-Mixteco-tlay%C3%BAa/347827821941221","alvarado@geologia.unam.mx","",-97.91942,18.59286,"http://sic.gob.mx/ficha.php?table=museo&table_id=1208","2019-04-17 10:53:32-05"
1952,"Museo Regional de Tepexi","","2011-01-28","Ayuntamiento de Tepexi de Rodríguez",21,"Puebla",169,"Tepexi de Rodríguez",1,"Tepexi de Rodríguez","Portal Hidalgo 1","Centro","74690","(224) 421 58 02","http://viajaporpuebla.mx/es/museos/item/museo-regional-de-tepexi","","coordinacionregional2@hotmail.com","",-97.92623,18.58084,"http://sic.gob.mx/ficha.php?table=museo&table_id=1952","2019-04-17 10:53:15-05"
1446,"Museo Comunitario de San Felipe Otlaltepec ","Arqueología","1996-01-01","Comunitario",21,"Puebla",169,"Tepexi de Rodríguez",14,"San Felipe Otlaltepec","Domicilio conocido","Centro","74699","(224) 433 82 19","http://viajaporpuebla.mx/es/museos/item/museo-comunitario-de-san-felipe-otlaltepec","","justidom@yahoo.com.mx; palmapopolocahotmail.com","",-97.92973,18.5843,"http://sic.gob.mx/ficha.php?table=museo&table_id=1446","2019-04-17 10:52:53-05"
1561,"Museo de Sitio de Cantona","Arqueología","2012-10-10","Secretaría de Cultura/INAH",21,"Puebla",170,"Tepeyahualco",1,"Tepeyahualco","Carr. Tepeyahualco-Xonacatlán Km.  7.5, Unidad de servicios de la zona Arqueológica de Cantona","Centro","73990","(276) 111 67 58","http://www.inah.gob.mx/red-de-museos/263-museo-de-sitio-de-cantona","","pastrana0@hotmail.com","",-97.49762,19.5499,"http://sic.gob.mx/ficha.php?table=museo&table_id=1561","2020-02-17 04:23:56-06"
1444,"Museo Regional Caltonac","Arqueología","2010-01-23","Fundación Caltonac en Memoria de Juventino Limón, A.C.",21,"Puebla",170,"Tepeyahualco",1,"Tepeyahualco","Hidalgo 12","Centro","73990","(282) 828 81 80","","https://poblanos.tv/2018/08/22/museo-regional-caltonac/","reservaciontepetlcalli1870@hotmail.com; hthadmon@gmail.com","",-97.48922,19.49002,"http://sic.gob.mx/ficha.php?table=museo&table_id=1444","2019-04-17 10:57:49-05"
1447,"Museo de los Tres Juanes","Historia","2008-02-15","Ayuntamiento de Tetela de Ocampo",21,"Puebla",172,"Tetela de Ocampo",1,"Ciudad de Tetela de Ocampo","Calle 20 de Noviembre","Centro","73640","(797) 973 01 88 ext. 218","","","luna_7_02@hotmail.com ","",-97.8065,19.8165,"http://sic.gob.mx/ficha.php?table=museo&table_id=1447","2021-08-23 04:42:02-05"
1902,"Museo de Sitio de Teteles de Santo Nombre","Arqueología","2017-01-25","Secretaría de Cultura/INAH",21,"Puebla",172,"Tetela de Ocampo",1,"Ciudad de Tetela de Ocampo","Carr.Tlacotepec Zona Arqueológica km. 13","","75680","55 3484 4117","https://www.inah.gob.mx/boletines/5875-abren-la-zona-arqueologica-teteles-de-santo-nombre-y-su-museo-de-sitio","","museoyzonateteles@hotmail.com","",-97.73357,18.62976,"http://sic.gob.mx/ficha.php?table=museo&table_id=1902","2020-02-19 08:33:03-06"
2090,"Museo de Sitio de la Zona Arqueológica de Tepapayeca","","1000-01-01","Secretaría de Cutura/INAH",21,"Puebla",185,"Tlapanalá",30,"Tlapanala","Carret. Fed.160 dirección Oaxaca, en el km 129 ","Santa María de la Candelaria","74540","(222) 235 14 78","https://www.inah.gob.mx/zonas/55-zona-arqueologica-de-tepapayeca","","dirección.pue@inah.gob.mx","",-98.53917,18.70004,"http://sic.gob.mx/ficha.php?table=museo&table_id=2090","2019-06-21 05:05:36-05"
