museo_id,museo_nombre,museo_tematica_n1,museo_fecha_fundacion,museo_adscripcion,estado_id,nom_ent,municipio_id,nom_mun,localidad_id,nom_loc,museo_calle_numero,museo_colonia,museo_cp,museo_telefono1,pagina_web,pagina_web2,email,twitter,gmaps_longitud,gmaps_latitud,link_sic,fecha_mod
1841,"Museo del Centro Interpretativo Guachimontones","","1970-01-01","Secretaría de Cultura del Estado de Jalisco",14,"Jalisco",95,"Teuchitlán",1,"Teuchitlán","Carretera Estatal 604 Guadalajara--San Marcos Gral. Lucio Blanco","","46762"," 384 109 03 88","https://sc.jalisco.gob.mx/patrimonio/museos/museo-de-arqueologia-guachimontones","","","",-103.83942,20.69226,"http://sic.gob.mx/ficha.php?table=museo&table_id=1841","2021-03-22 08:49:03-06"
1392,"Museo Arqueológico de San Agustín","Arqueología","2009-12-09","Ayuntamiento de Tlajomulco de Zúñiga",14,"Jalisco",97,"Tlajomulco de Zúñiga",25,"San Agustín","Pedro Loza 127","Centro","45640","(33) 3694 0407","","","gsarreola@tlajomulco.gob.mx; institutotlajomulco@gmail.com","",-103.46764,20.54688,"http://sic.gob.mx/ficha.php?table=museo&table_id=1392","2021-03-22 08:59:30-06"
250,"Museo Regional de la Cerámica","Arte","1954-12-06","Instituto de la Artesanía Jalisciense",14,"Jalisco",98,"San Pedro Tlaquepaque",1,"Tlaquepaque","Independencia 237","Centro","45500","(33) 3635 5404","","","ceramicamuseo@gmail.com","",-103.3144,20.63907,"http://sic.gob.mx/ficha.php?table=museo&table_id=250","2021-08-13 05:28:04-05"
202,"Museo Municipal Pantaleón Panduro del Premio Nacional de la Cerámica","Arte","1997-11-03","Ayuntamiento de San Pedro Tlaquepaque",14,"Jalisco",98,"San Pedro Tlaquepaque",1,"Tlaquepaque","Prisciliano Sánchez 191","Centro Histórico","45500","(33) 3639 5646","https://sc.jalisco.gob.mx/patrimonio/museos/museo-del-premio-nacional-de-la-ceramica-pantaleon-panduro","","direccion.pantaleonpanduro@gmail.com","",-103.31279,20.64261,"http://sic.gob.mx/ficha.php?table=museo&table_id=202","2021-03-23 08:53:07-06"
270,"Museo Nacional de la Cerámica Jorge Wilmot","Arte","1985-02-12","Ayuntamiento de Tonalá",14,"Jalisco",101,"Tonalá",1,"Tonalá","Constitución 104","Centro","45400","(33)  3683 2519 ext. 1194","https://sc.jalisco.gob.mx/patrimonio/museos/museo-nacional-de-la-ceramica-jorge-wilmot","","miguelangeljareromelchor@gmail.com","",-103.24307,20.62661,"http://sic.gob.mx/ficha.php?table=museo&table_id=270","2021-03-23 08:47:28-06"
1031,"Museo Regional Tonallan","Antropología","1997-11-29","Ayuntamiento de Tonalá",14,"Jalisco",101,"Tonalá",1,"Tonalá","Ramón Corona 73","Centro","45400","(33) 1200 3936","http://tonalajaliscoes1.wixsite.com/tonala/museo-regional-tonallan","","","",-103.23979,20.62491,"http://sic.gob.mx/ficha.php?table=museo&table_id=1031","2017-05-15 10:28:35-05"
515,"Museo San Cristóbal Magallanes","Historia","1994-09-29","Arzobispado de Guadalajara/Parroquia de Nuestra Señora del Rosario",14,"Jalisco",104,"Totatiche",1,"Totatiche","Hidalgo 32","Centro","46170","(437) 964 01 21","","","","",-103.44308,21.92926,"http://sic.gob.mx/ficha.php?table=museo&table_id=515","2018-08-08 06:13:44-05"
32,"Museo Municipal de Antropología e Historia Drs. Barba-Piña Chan","Arqueología","1983-09-16","Ayuntamiento de Valle de Guadalupe",14,"Jalisco",111,"Valle de Guadalupe",1,"Valle de Guadalupe","Silvano Barba González s/n","Centro","47380","(347) 714 00 40","","","direcciondecultura.valledegpeoutlook.com","",0,0,"http://sic.gob.mx/ficha.php?table=museo&table_id=32","2018-07-30 05:30:49-05"
1021,"Museo de Arte de Zapopan (MAZ)","Arte","2002-08-02","Ayuntamiento de Zapopan, Coordinación General de Construcción de Comunidad",14,"Jalisco",120,"Zapopan",1,"Zapopan","Andador 20 de Noviembre 166","Centro","45100","(33) 3818 2575","https://maz.zapopan.gob.mx/","","mazinfo@zapopan.gob.mx","",-103.38987,20.72039,"http://sic.gob.mx/ficha.php?table=museo&table_id=1021","2021-08-13 08:32:45-05"
1943,"Museo de la Radio y la Televisión (MURTV)","","2016-05-05","Museo de la Radio y la Televisión, A.C.",14,"Jalisco",120,"Zapopan",1,"Zapopan","Av. Central Guillermo González Camarena 375","Col. Residencial Poniente","45136","(33) 9690 9075, 9690 9000","","","","",-103.4303,20.72603,"http://sic.gob.mx/ficha.php?table=museo&table_id=1943","2021-01-18 03:10:16-06"
1026,"Museo Etnográfico Huichol Wixxarika","Antropología","1998-07-25","Basílica de Zapopan",14,"Jalisco",120,"Zapopan",1,"Zapopan","Eva Briseño 152, Antigua Sala Capitular, anexo a la Basílica de Zapopan","Centro","45100","33 3636 4430","","","museodeartehuicholwixxarika@hotmail.com","",0,0,"http://sic.gob.mx/ficha.php?table=museo&table_id=1026","2021-07-29 08:21:45-05"
235,"Trompo Mágico Museo Interactivo ","Ciencia y tecnología","2003-04-30","Secretaría General del Gobierno de Jalisco",14,"Jalisco",120,"Zapopan",1,"Zapopan","Av. Central 750","Fracc. Residencial Pte.","45136","(33) 3030 0001, 3030 0002","http://trompomagico.jalisco.gob.mx/","","trompomagico@red.jalisco.gob.mx","",-103.43149,20.72267,"http://sic.gob.mx/ficha.php?table=museo&table_id=235","2021-03-17 02:40:22-06"
1500,"Museo de las Chivas-COMEX","Especializado","1906-05-08","Club Deportivo Guadalajara, S.A. de C.V.",14,"Jalisco",120,"Zapopan",1,"Zapopan","Av. Circuito JVC 2800","Col. El Bajío","45019","(33) 3777 5757","","","toursestadio@chivasdecorazon.com.mx","",-103.46157,20.68197,"http://sic.gob.mx/ficha.php?table=museo&table_id=1500","2019-10-22 08:31:06-05"
91,"Museo Comunitario Antonio Vargas Moreno","Antropología","1000-01-01","Ayuntamiento de Zapotiltic",14,"Jalisco",121,"Zapotiltic",22,"San José de la Tinaja","Corona 239","","49638","(341) 151 07 18","","","ramiromx2015@gmail.com","",0,0,"http://sic.gob.mx/ficha.php?table=museo&table_id=91","2017-10-24 12:40:28-05"
1268,"Museo Arqueológico Profra. Ma. Esther de la Torre Sánchez","Arqueología","2008-06-06","Ayuntamiento de Zapotitlán de Vadillo",14,"Jalisco",122,"Zapotitlán de Vadillo",1,"Zapotitlán de Vadillo","Juan Ortega 25","Centro","49770","(343) 434 09 76","","","ayala.audio@gmail.com; princess_tmm@hotmail.com","",-103.81458,19.54558,"http://sic.gob.mx/ficha.php?table=museo&table_id=1268","2018-03-12 09:42:14-06"
1238,"Museo Profr. Gustavo Ramos Jiménez","TND","2008-08-15","Ayuntamiento de Zapotitlán de Vadillo",14,"Jalisco",122,"Zapotitlán de Vadillo",40,"Tetapán (Tetiapán)","HIdalgo 1","Centro","49770","Cel. (341) 122 77 82","","","cultura-zapotitlan@hotmail.com; cculturazapotitlan@hotmail.com","",0,0,"http://sic.gob.mx/ficha.php?table=museo&table_id=1238","2017-02-22 11:35:15-06"
352,"Museo Regional de Acambay Antonio Ruiz Pérez","Arqueología","1999-09-09","Secretaría de Cultura y Turismo del Estado de México",15,"México",1,"Acambay de Ruíz Castañeda",1,"Villa de Acambay de Ruíz Castañeda","Alfonso Navarrete 4","Centro ","50300","718 127 06 13","https://patrimonioyserviciosc.edomex.gob.mx/patrimonio/museos/centro-cultural-otomi","","martinezignacio16@yahoo.com","",-99.84583,19.95528,"http://sic.gob.mx/ficha.php?table=museo&table_id=352","2020-12-10 07:35:40-06"
480,"Museo Virreinal de Acolman, Ex Convento de San Agustín","Arte","1925-01-01","Secretaría de Cultura y Turismo del Estado de México / INAH",15,"México",2,"Acolman",1,"Acolman de Nezahualcóyotl","Calz. de los Agustinos s/n","Col. San Agustín Acolman de Nezahualcóyotl","55870","594 957 16 44","https://www.inah.gob.mx/red-de-museos/258-ex-convento-de-acolman","http://www.inah.gob.mx/paseos/exacolman/","exconvento.acolman.inah@gmail.com; elena_gonzalez@inah.gob.mx","",-98.91309,19.63218,"http://sic.gob.mx/ficha.php?table=museo&table_id=480","2020-12-10 07:28:37-06"
1002,"Museo de Tepexpan","Ciencia y tecnología","1955-01-01","Secretaría de Cultura y Turismo del Estado de México / INAH",15,"México",2,"Acolman",15,"Tepexpan","Carr. México-Teotihuacán Km. 32","Col. Anáhuac","55855","594 957 02 23 ","http://www.inah.gob.mx/es/red-de-museos/232-museo-de-tepexpan","","cinah_edomex@inah.gob.mx; jorge_valencia@inah.gob.mx","",-98.9474,19.61377,"http://sic.gob.mx/ficha.php?table=museo&table_id=1002","2020-12-03 07:17:17-06"
1358,"Museo de Sor Juana Inés de la Cruz ","Historia","2000-03-04","Hacienda Panoaya, S.A. de C.V.",15,"México",9,"Amecameca",1,"Amecameca de Juárez","Int. Parque Hacienda Panoaya, Km 58 Carr. Federal México-Cuautla","Barrio Panoaya","56900","(597) 978 50 50","https://haciendapanoaya.com/museo-de-sor-juana","","correo@haciendapanoaya.com","",-98.77207,19.14134,"http://sic.gob.mx/ficha.php?table=museo&table_id=1358","2021-07-26 06:40:10-05"
2114,"Museo Internacional de los Volcanes","","1000-01-01","Hacienda de Panoaya",15,"México",9,"Amecameca",1,"Amecameca de Juárez","Carret. Federal Mexico-Cuautla Km. 58, Panoaya","","56900","(597) 978 50 50","https://haciendapanoaya.com/museo-internacional-de-los-volcanes","","correo@haciendapanoaya.com","",-98.77125,19.14184,"http://sic.gob.mx/ficha.php?table=museo&table_id=2114","2021-07-26 07:06:46-05"
343,"Museo Arqueológico Apaxco","Arqueología","1990-10-13","Secretaría de Cultura y Turismo del Estado de México",15,"México",10,"Apaxco",1,"Apaxco de Ocampo","Plaza Melchor Ocampo s/n","Centro","55660","599 998 21 79","http://patrimonioyserviciosc.edomex.gob.mx/arqueologico_apaxco","","apaxcoimc@yahoo.com.mx","",-99.17435,19.97564,"http://sic.gob.mx/ficha.php?table=museo&table_id=343","2020-12-10 07:20:33-06"
201,"Museo Adolfo López Mateos","Historia","1994-09-22","Secretaría de Cultura y Turismo del Estado de México",15,"México",13,"Atizapán de Zaragoza",1,"Ciudad López Mateos","Av. Lic. Adolfo López Mateos s/n","Centro","52900","55 5822 9220","http://patrimonioyserviciosc.edomex.gob.mx/lopez_mateos","","museoadolfolopezmateos@gmail.com","",-99.2468,19.56179,"http://sic.gob.mx/ficha.php?table=museo&table_id=201","2021-03-09 09:01:56-06"
1707,"Museo Histórico de Atlacomulco","Historia","2009-02-05","Secretaria del Ayuntamiento de Atlacomulco",15,"México",14,"Atlacomulco",1,"Atlacomulco de Fabela","Av. Mario Colín Sánchez s/n esq. con Calzada Las Fuentes","Parque Bicentenario","50450","(712) 112 84 50","","","museo@atlacomulco.gob.mx","",-99.8737,19.7971,"http://sic.gob.mx/ficha.php?table=museo&table_id=1707","2020-03-02 03:25:53-06"
288,"Museo Isidro Fabela","Historia","1969-09-13","Secretaría de Cultura y Turismo del Estado de México",15,"México",14,"Atlacomulco",1,"Atlacomulco de Fabela","Plaza de la Constitución 1","Centro","50450","712 122 02 11","https://patrimonioyserviciosc.edomex.gob.mx/isidro_fabela_atlacomulco","","atlacomulcoimc@yahoo.com.mx","",-99.87367,19.79841,"http://sic.gob.mx/ficha.php?table=museo&table_id=288","2020-12-10 07:39:18-06"
467,"Santuario de la Siempre Virgen María de Guadalupe, Casa de San Juan Diego","Historia","2002-12-07","Diócesis de Cuautitlán",15,"México",24,"Cuautitlán",110,"Ejido de Santa Bárbara","Calz. Guadalupe s/n, Parroquia de El Cerrito","Barrio de Tlayacac","54879","(55) 5872 1545","","http://vicariasanbuenaventura.org/parroquia-la-siempre-virgen-maria-casa-de-san-juan-diego-santuario-diocesano/","altolo52@yahoo.com.mx","",-99.19189,19.66826,"http://sic.gob.mx/ficha.php?table=museo&table_id=467","2019-08-20 05:47:21-05"
2018,"Casa Museo de Cartonería","Arte","2008-01-01","Colección privada",15,"México",25,"Chalco",1,"Chalco de Díaz Covarrubias","San Miguel 15-A","Centro","56623","Cel. (55) 1709 6697","","","","",-98.93202,19.21113,"http://sic.gob.mx/ficha.php?table=museo&table_id=2018","2021-01-21 04:36:03-06"
2024,"Planetario Digital de Chimalhuacán","","2018-05-01","Ayuntamiento de Chimalhuacán/Parque Ecoturístico El Chimalhuache",15,"México",31,"Chimalhuacán",1,"Chimalhuacán","Calle Jardines  s/n","Xochiaca","56340","","","https://es-la.facebook.com/PlanetarioDigitalChimalhuacan/","","",-98.96232,19.40758,"http://sic.gob.mx/ficha.php?table=museo&table_id=2024","2018-08-29 07:30:40-05"
533,"Museo de Sitio de Chimalhuacán","Arqueología","2000-01-01","Secretaría de Cultura y Turismo del Estado de México / INAH",15,"México",31,"Chimalhuacán",1,"Chimalhuacán","Los Pochotes s/n","Barrio de San Andrés","53360","722 215 7080","http://www.inah.gob.mx/es/red-de-museos/231-museo-de-sitio-de-chimalhuacan","","cinah_edomex@inah.gob.mx; jorge_valencia@inah.gob.mx","",-98.94726,19.41786,"http://sic.gob.mx/ficha.php?table=museo&table_id=533","2020-12-11 07:22:36-06"
1521,"Museo de Historia Natural de Ecatepec","Ciencia y tecnología","2012-01-16","Ayuntamiento de Ecatepec",15,"México",33,"Ecatepec de Morelos",1,"Ecatepec de Morelos","Circunvalación Ote. s/n","Col. Jardines de Santa Clara ","55450","55 5774 4671","","","museohistorianaturalecatepec@hotmail.com","",-99.03683,19.54688,"http://sic.gob.mx/ficha.php?table=museo&table_id=1521","2021-03-09 09:30:21-06"
712,"Museo de la Pluma. Ing. Jesús Humberto Rodríguez Lozano","Especializado","2003-10-09","Tecnológico de Estudios Superiores de Ecatepec",15,"México",33,"Ecatepec de Morelos",1,"Ecatepec de Morelos","Av. Tecnológico s/n","Col. Valle de Anáhuac ","55210","55 5000 2353","http://biblioteca.tese.edu.mx","","biblioteca@tese.edu.mx","",-99.04056,19.51069,"http://sic.gob.mx/ficha.php?table=museo&table_id=712","2021-07-26 06:36:27-05"
996,"Centro Comunitario Ecatepec, Casa de Morelos","Historia","1990-01-01","Secretaría de Cultura y Turismo del Estado de México / INAH",15,"México",33,"Ecatepec de Morelos",1,"Ecatepec de Morelos","Ant. Carr. México-Pachuca s/n, Km 23.5","Col. San Juan Alcahuacan","55000","55 5839 5864","http://www.inah.gob.mx/es/red-de-museos/282-centro-comunitario-ecatepec-casa-de-morelos","","vicente_camacho@inah.gob.mx","",-99.03565,19.60036,"http://sic.gob.mx/ficha.php?table=museo&table_id=996","2020-12-10 03:02:02-06"
1692,"Museo de Huixquilucan","Historia","2013-04-11","Ayuntamiento de Huixquilucan/Subdirección de Cultura",15,"México",37,"Huixquilucan",1,"Huixquilucan de Degollado","Int. Jardín de la Cultura, Km 1.5 Carr. Zacamulpa, 5to. Cuartel","Barrio San Juan Bautista","52760","(55) 8284 2220","","","culturahxq@gmail.com","",-99.34124,19.35803,"http://sic.gob.mx/ficha.php?table=museo&table_id=1692","2017-06-06 12:13:00-05"
366,"Museo Comunitario Xochilteptl","Historia","2001-12-12","Ayuntamiento de Juchitepec",15,"México",50,"Juchitepec",1,"Juchitepec de Mariano Rivapalacio","Av. Independencia Sur s/n","Barrio Calayuco","56860","(597) 977 08 72 y 74 ext. 111","","","culturajuchi@yahoo.com.mx","",0,0,"http://sic.gob.mx/ficha.php?table=museo&table_id=366","2016-07-15 11:06:23-05"
1949,"Zanbatha, Museo del Valle de la Luna","Historia","1000-01-01","Ayuntamiento de Lerma",15,"México",51,"Lerma",1,"Lerma de Villada","Av. Hidalgo 22","Centro","52000","(728) 282 09 69","http://zanbatha.lerma.gob.mx/","","museo@lerma.gob.mx","",-99.51021,19.2864,"http://sic.gob.mx/ficha.php?table=museo&table_id=1949","2018-05-18 08:59:15-05"
277,"Museo Universitario Dr. Luis Mario Schneider","Antropología","2001-05-18","Universidad Autónoma del Estado de México",15,"México",52,"Malinalco",1,"Malinalco","Amajac s/n","Barrio Santa Mónica","52440","(714) 147 12 88","http://malinalco.net/inicio/turismo/museo-luis-mario-schnaider/","","schneider@uaemex.mx","",-99.50115,18.95084,"http://sic.gob.mx/ficha.php?table=museo&table_id=277","2019-07-11 06:27:11-05"
2102,"Museo de sitio de la Zona Arqueológica de Malinalco","","1000-01-01","Secretaría de Cultura/INAH",15,"México",52,"Malinalco",1,"Malinalco","Domicilio Conocido","Barrio Santa Mónica","52440","(722) 215 70 80","https://www.inah.gob.mx/zonas/135-zona-arqueologica-malinalco","","cinah_edomex@inah.gob.mx ","",-99.5034,18.95347,"http://sic.gob.mx/ficha.php?table=museo&table_id=2102","2019-06-21 08:20:25-05"
1658,"Museo del Barro","Arte","2012-09-14","Ayuntamiento de Metepec",15,"México",54,"Metepec",1,"Metepec","Av. Estado de México 10","Barrio de Santiaguito","52140","(722) 208 44 34","","","alexcorovel@hotmail.com; almapatricia.alvarado@gmail.com; angelesnovoa61@outlook.com","",-99.60202,19.25019,"http://sic.gob.mx/ficha.php?table=museo&table_id=1658","2019-01-09 07:04:22-06"
783,"Museo Tlatilca","Arqueología","2012-09-16","Instituto de Cultura y Parque Naucalli",15,"México",57,"Naucalpan de Juárez",1,"Naucalpan de Juárez","Blvd. Avila Camacho s/n","Fracc. El Mirador","53050","(55) 5300 2705","http://www.soymexiquense.com/edomex/region-viii/naucalpan/35-museo-tlatilco","","sandovalm165@gmail.com","",-99.23203,19.47914,"http://sic.gob.mx/ficha.php?table=museo&table_id=783","2019-10-14 04:14:43-05"
1914,"Museo del Agua","","2012-12-17","Organismo de Agua Potable, Alcantarillado y Saneamiento (OAPAS) ",15,"México",57,"Naucalpan de Juárez",1,"Naucalpan de Juárez","Circuito Margaritas","Jardines El Molinito","53530","(55) 5300 6250","","","lucialeon@oapas-naucalpan.gob.mx","",-99.23986,19.45956,"http://sic.gob.mx/ficha.php?table=museo&table_id=1914","2017-05-25 11:26:22-05"
1938,"Museo Salón Deporte","Especializado","2017-10-18","Fundación Carlos Slim/Gobierno del Estado de México",15,"México",57,"Naucalpan de Juárez",1,"Naucalpan de Juárez","Ingenieros Militares s/n","Plaza Cetram","53489","","","","","@salondeportefcs",-99.215,19.45754,"http://sic.gob.mx/ficha.php?table=museo&table_id=1938","2021-01-21 07:49:14-06"
355,"Museo Arqueológico de Nextlalpan","Arqueología","1994-09-17","Secretaría de Cultura del Estado de México",15,"México",59,"Nextlalpan",1,"Santa Ana Nextlalpan","Av. Estación s/n","Pueblo  Xaltocan","55790","(55) 4911 7037","http://patrimonioyserviciosc.edomex.gob.mx/museo_nextlalpan","","sh221168@yahoo.com.mx","",-99.04908,19.7235,"http://sic.gob.mx/ficha.php?table=museo&table_id=355","2019-01-09 05:18:14-06"
284,"Museo Dr. José María Luis Mora","Arqueología","1988-05-13","Secretaría de Cultura del Estado de México",15,"México",62,"Ocoyoacac",1,"Ocoyoacac","Plaza de los Insurgentes s/n","Centro","52740","(728) 287 78 32","http://patrimonioyserviciosc.edomex.gob.mx/dr_luis_mora","","nhd_14@hotmail.com","",-99.46104,19.27402,"http://sic.gob.mx/ficha.php?table=museo&table_id=284","2021-01-21 06:10:18-06"
290,"Museo Arqueológico Colonial de Ocuilan","Arqueología","1994-02-19","Secretaría de Cultura y Turismo del Estado de México",15,"México",63,"Ocuilan",1,"Ocuilan de Arteaga","Ayuntamiento s/n","Centro","52480","722 495 30 36","http://patrimonioyserviciosc.edomex.gob.mx/sitio_ocuilan_arteaga","","ignaciocruz1127@live.com","",0,0,"http://sic.gob.mx/ficha.php?table=museo&table_id=290","2021-07-08 11:19:25-05"
285,"Museo de la Minería de El Oro","Ciencia y tecnología","1975-09-01","Secretaría de Cultura y Turismo del Estado de México",15,"México",64,"El Oro",1,"El Oro de Hidalgo","Tiro Norte s/n","Col. El Carmen","50600","711 125 07 39","http://patrimonioyserviciosc.edomex.gob.mx/mineria_el_oro","https://www.mexicotravelclub.com/museo-de-la-mineria-en-el-oro-estado-de-mexico","mineriaamg@hotmail.com","",-100.13284,19.79848,"http://sic.gob.mx/ficha.php?table=museo&table_id=285","2021-07-19 06:57:39-05"
1420,"Museo del Ferrocarril en Otumba","Historia","2006-12-16","Ayuntamiento de Otumba de Gómez Farías/Amigos del Ferrocarril en Otumba A.C.",15,"México",65,"Otumba",1,"Otumba de Gómez Farías","Av. Hidalgo núm. 51 ","Col. La Estación","55900","(592) 922 13 89","http://www.museoferrocarril.mex.tl","","amigosfcenotumba@yahoo.com.mx","",-98.75696,19.70877,"http://sic.gob.mx/ficha.php?table=museo&table_id=1420","2021-01-21 05:55:25-06"
257,"Casa Museo Gonzalo Carrasco","Historia","1985-11-13","Secretaría de Cultura del Gobierno del Estado de México",15,"México",65,"Otumba",1,"Otumba de Gómez Farías","Plaza de la Constitución 17","Centro","55900","(592) 922 01 61","http://patrimonioyserviciosc.edomex.gob.mx/gonzalo_carrasco","","otumbaimc@yahoo.com.mx","",-98.75724,19.69985,"http://sic.gob.mx/ficha.php?table=museo&table_id=257","2021-01-28 09:45:10-06"
885,"Museo de los Murales Teotihuacanos Beatriz de la Fuente","Arqueología","2000-11-30","Secretaría de Cultura/INAH",15,"México",75,"San Martín de las Pirámides",1,"San Martín de las Pirámides","Carr. Ecatepec-Pirámides km 22 +600, Circuito Paseo de los Dioses 1, puerta 3","Zona Arqueológica de Teotihuacán","55850","(594) 958 20 81","http://www.inah.gob.mx/es/red-de-museos/242-museo-de-los-murales-teotihuacanos-beatriz-de-la-fuente","http://museosdeteotihuacan.blogspot.mx/","teotihuacanvisitasguiadas@inah.gob.mx","",-98.8471,19.70039,"http://sic.gob.mx/ficha.php?table=museo&table_id=885","2020-02-13 06:33:45-06"
1368,"Sala museográfica de la Casa de Cultura  Dr. José María Cos","Historia","1983-08-24","Ayuntamiento de Sultepec",15,"México",80,"Sultepec",1,"Sultepec de Pedro Ascencio de Alquisiras","Av. Hidalgo s/n","Barrio de Coaxusco","51600","(716) 148 03 96","","","casadecultura@sultepec.gob.mx","",0,0,"http://sic.gob.mx/ficha.php?table=museo&table_id=1368","2018-05-18 11:13:27-05"
291,"Museo de Sitio de San Miguel Ixtapan","Arqueología","1994-12-14","Secretaría de Cultura del Estado de México",15,"México",82,"Tejupilco",1,"Tejupilco de Hidalgo","Carr. Tejupilco-Amatepec s/n","Col. San Miguel Ixtapan","51430","(724) 269 42 27","http://patrimonioyserviciosc.edomex.gob.mx/sitio_san_miguel_ixtapan","","inocentelopez18@hotmail.com","",-100.15498,18.807,"http://sic.gob.mx/ficha.php?table=museo&table_id=291","2019-01-09 07:34:37-06"
97,"Museo Casa de Madera","Arte","1992-03-29","Fundación Museo Casa de Madera, S.C.",15,"México",89,"Tenango del Aire",1,"Tenango del Aire","Av. Revolución 2, Delegación San Mateo Tepopula","Centro","56780","597 982 51 74","","","mcasademadera@gmail.com","",-98.85558,19.15722,"http://sic.gob.mx/ficha.php?table=museo&table_id=97","2020-12-08 07:54:42-06"
354,"Museo Arqueológico del Estado de México Dr. Román Piña Chan","Arqueología","1975-07-15","Secretaría de Cultura del Estado de México",15,"México",90,"Tenango del Valle",1,"Tenango de Arista","Av. Dr. Román Piña Chan 1014","Col. Teotenango","52300","(717) 144 13 44","http://patrimonioyserviciosc.edomex.gob.mx/ramon_pina","","teutenanco@yahoo.com.mx","",-99.59598,19.11048,"http://sic.gob.mx/ficha.php?table=museo&table_id=354","2021-06-29 04:16:59-05"
836,"Museo de la Cultura Teotihuacana","Arqueología","1963-04-01","Secretaría de Cultura/INAH",15,"México",92,"Teotihuacán",1,"Teotihuacán de Arista","Carr. Ecatepec-Pirámides km 22,600. Zona Arqueológica de Teotihuacán","","55800","594 958 20 81","http://www.inah.gob.mx/es/red-de-museos/241-museo-de-la-cultura-teotihuacana","","teotihuacanmuseos@inah.gob.mx; elba_estrada@inah.gob.mx","",-98.84957,19.68292,"http://sic.gob.mx/ficha.php?table=museo&table_id=836","2020-03-24 08:45:00-06"
997,"Museo Comunitario Quetzalpapalotl","Historia","1998-10-13","Ayuntamiento de Teotihuacán",15,"México",92,"Teotihuacán",1,"Teotihuacán de Arista","Cuauhtémoc 20","Centro","55800","(594) 933 20 17","","https://www.facebook.com/pages/Museo-Comunitario-Quetzalpapalotl/1583909691842773","varaher@gmail.com","",0,0,"http://sic.gob.mx/ficha.php?table=museo&table_id=997","2017-03-27 12:03:54-06"
1708,"Museo Eremitorio de Fray Domingo de Betanzos","Historia","2005-04-01","Ayuntamiento de Tepetlaoxtoc",15,"México",93,"Tepetlaoxtoc",1,"Tepetlaoxtoc de Hidalgo","Fray Domingo de Betanzos s/n","Centro","56070","(595) 923 09 97","","","turismotepetlaoxtoc@hotmail.com","",-98.82467,19.57314,"http://sic.gob.mx/ficha.php?table=museo&table_id=1708","2016-09-02 10:00:01-05"
999,"Museo-Casa Juana Inés","Arte","1995-04-17","Secretaría de Cultura y Deporte del Gobierno del Estado de México",15,"México",94,"Tepetlixpa",2,"Nepantla de Sor Juana Inés de la Cruz","Cto. Sur Sor Juana Inés de la Cruz s/n","Col. Casco Urbano","56890","597 977 30 38","http://patrimonioyserviciosc.edomex.gob.mx/ccsjic","","nepantlascd.edomex@gmail.com; juanainesnepantla@gmail.com","",-98.83972,18.98005,"http://sic.gob.mx/ficha.php?table=museo&table_id=999","2020-06-16 10:58:28-05"
823,"Museo Nacional del Virreinato","Arte","1964-09-01","Secretaría de Cultura/INAH",15,"México",95,"Tepotzotlán",1,"Tepotzotlán","Plaza Hidalgo 99","Barrio San Martín","54600","(55) 5876 2770 ext. 412829","https://www.inah.gob.mx/red-de-museos/267-museo-nacional-del-virreinato","","virreinato.museo@inah.gob.mx; mercedes_gomezurquiza@inah.gob.mx","Virreinato",-99.22177,19.71321,"http://sic.gob.mx/ficha.php?table=museo&table_id=823","2020-03-30 17:02:29-06"
1001,"Museo Nacional de Agricultura","Ciencia y tecnología","1987-01-01","Universidad Autónoma Chapingo",15,"México",99,"Texcoco",1,"Texcoco de Mora","Carr. México-Texcoco Km. 38.5","Col. Chapingo","56230","(595) 952 17 01","","http://www.chapingo.mx/","museochapingo@gmail.com","",-98.88831,19.49001,"http://sic.gob.mx/ficha.php?table=museo&table_id=1001","2019-09-18 06:32:05-05"
1306,"Museo Paleontológico de Tocuila","Ciencia y tecnología","1996-01-01","Asociación Mexicana de Turismo para el Desarrollo de la Región Oriente del Estado de México, A.C.",15,"México",99,"Texcoco",1,"Texcoco de Mora","Calle 16 de Septiembre","Centro","56208","","","","","",-98.90793,19.52065,"http://sic.gob.mx/ficha.php?table=museo&table_id=1306","2021-08-26 10:58:35-05"
1524,"Museo del Centro Cultural Mexiquense Bicentenario","Arte","2011-08-31","Secretaría de Cultura y Turismo del Estado de México",15,"México",99,"Texcoco",1,"Texcoco de Mora","Carr. Federal MéxicoLos Reyes, La Paz Texcoco Km 14.3","Col. Coatlinchan","56250","(595) 952 03 20 ext. 1025","http://patrimonioyserviciosc.edomex.gob.mx/ccm",""," ddeacervoccmb@hotmail.com","",-98.89648,19.45188,"http://sic.gob.mx/ficha.php?table=museo&table_id=1524","2020-12-03 07:16:05-06"
